{
  "schema_version": 1,
  "issue_id": "2026-09-04",
  "issue_date": "2026-09-04",
  "display_date": "2026.09.04",
  "title": "2026年9月4日刊",
  "categories": [
    {
      "id": "policy",
      "title": "政策趋势与监管",
      "icon": "ShieldCheck",
      "description": "数据要素、人工智能、交通运输与道路货运相关规则和监管变化",
      "news": [
        {
          "id": "FXHY-20260904-PR-002",
          "sourceTitle": "工信部批准无人驾驶工业车辆及10项车联网安全标准，分批于2026年12月和2027年3月实施",
          "sourceUrl": "https://wap.miit.gov.cn/zwgk/zcwj/wjfb/gg/art/2026/art_74c4c2a0052143fcacd282226eedba23.html",
          "sourceLabel": "工业和信息化部",
          "date": "2026-09-01",
          "eventProperty": "一方面推动园区、仓库和货站工业车辆的无人化及车载终端制造标准化；另一方面建立覆盖安全认证、软件测试、能力评价、风险分级、证书接口和持续监测的车联网安全标准链。",
          "coreFacts": "工业车辆方面，JB/T 13696—2026规定无人驾驶工业车辆的型式、基本参数、技术要求、试验方法和检验规则，JB/T 15735—2026规定工业车辆车载终端的技术、试验和检验要求。车联网安全方面，YD/T 7220—7229依次覆盖PKI安全认证体系、应用软件安全、网络安全能力成熟度评价准则与实施方法及模型、第三方安全服务机构能力认定、网络安全风险评估与分类分级、X.509和V2X数字证书应用接口、密码应用安全监测平台，形成从身份认证、开发测试到评估监测的标准组合。",
          "strategicSignal": "车联网安全治理正在由原则性、单点式防护转向可测试、可分级、可评价和可审计的工程化体系，安全要求贯穿软件开发、车辆与平台接入、证书管理、风险治理、第三方评估和运营监测全过程。同时，场内工业车辆的无人化及终端能力开始进入更细的制造、测试和检验规范阶段。",
          "businessConnection": "可围绕PKI与证书接口、应用软件测试、成熟度评价、风险分级、密码监测、日志审计和供应商管理建立车联网安全能力核对清单；在园区或货站项目中，将工业车辆车载终端标准作为设备选型和接口接入参考。需要明确，JB/T 13696—2026适用于GB/T 6104.1定义的工业车辆，不能作为道路干线L4无人货运车辆的准入依据。",
          "judgmentSuggestion": "由安全、平台和终端团队在2026年12月前核对PKI、应用软件测试、成熟度、风险分级、证书接口、密码监测和日志审计能力。\n针对园区或货站车辆项目，确认JB/T 15735—2026与现有OBD、视频、定位和车载终端接口的适用边界。",
          "rating": 5,
          "summary": "工业和信息化部9月1日批准674项行业标准，其中与车辆数字化相关的标准分为两组：JB/T 13696—2026《无人驾驶工业车辆》和JB/T 15735—2026《工业车辆 车载终端》规范场内无人车辆及车载终端的制造、技术、试验和检验要求，2027年3月1日实施；YD/T 7220—7229共10项车联网安全标准覆盖PKI认证、应用软件安全、能力成熟度、风险评估与分级、数字证书接口及密码应用安全监测，2026年12月1日实施。",
          "interpretations": [],
          "downloads": [
            {
              "title": "官方原文",
              "url": "https://wap.miit.gov.cn/cms_files/filemanager/1226211233/attach/20268/30c01f53adfe417fb25bf86f4b8a20d0.pdf"
            }
          ]
        },
        {
          "id": "FXHY-20260904-PR-003",
          "sourceTitle": "工信部启动人工智能应用服务商培育，2026年底全国资源池拟突破2000家",
          "sourceUrl": "https://www.miit.gov.cn/zwgk/zcwj/wjfb/tz/art/2026/art_6fbc038bf15c445ab53b2a94a3f9d4e4.html",
          "sourceLabel": "工业和信息化部",
          "date": "2026-08-31",
          "eventProperty": "从通用人工智能能力供给转向懂行业痛点、能集成交付、能持续运营并内嵌安全合规的应用服务商体系。",
          "coreFacts": "专项行动要求地方建立服务商档案和资源池，组织原则上不少于10个人工智能应用服务团，每团由1家服务商牵头并联合不少于2家上下游单位。政策鼓励模块化标准化产品、真实场景开放、首购首用和风险补偿，并支持FDE团队驻场交付。",
          "strategicSignal": "政策评价维度正在从模型或算法本身扩展到行业知识、方案集成、现场交付、运营管理和安全治理。资源池、服务团和真实场景可能成为地方AI项目供需对接的重要入口，但通知没有承诺入池即获得资金或采购订单。",
          "businessConnection": "丰行的运输管理、车队运营、安全风控和能源管理场景可按高频、刚需、可复用原则整理为模块化服务包，并关注注册地工信主管部门后续入池要求。能否申报、由谁申报以及丰行或丰图能力归属，均需内部和地方规则确认。",
          "judgmentSuggestion": "在12月1日前跟踪注册地工信主管部门的资源池申报通知，核对主体资格、材料口径和时间表。\n选择运输管理、车队安全或新能源车队场景，整理一个小快轻准产品包及FDE交付、数据安全和成效验证材料。",
          "rating": 4,
          "summary": "工业和信息化部办公厅8月31日发布人工智能应用服务商培育专项行动，提出到2026年底全国服务商资源池内服务商数量突破2000家、到2027年底不少于3000家；各地区须在2026年12月1日前报送资源池和服务团信息。行动鼓励形成模块化、标准化的“小快轻准”产品服务，开放真实场景，并探索首购首用、风险补偿以及大模型、智能体和Token服务采购。",
          "interpretations": [],
          "downloads": []
        }
      ]
    },
    {
      "id": "competitor",
      "title": "竞合与标杆动向",
      "icon": "Target",
      "description": "聚焦重点企业、平台厂商与生态伙伴的关键动作，持续跟踪其在产品、业务、合作与市场拓展中的实际进展。重点提炼外部主体的策略变化、能力布局与落地路径，为判断竞争态势与产业格局提供参照。",
      "news": [
        {
          "id": "FXHY-20260904-CB-001",
          "sourceTitle": "Samsara收入与ARR均同比增长30%，公司称AI新功能采用加速",
          "sourceUrl": "https://www.businesswire.com/news/home/20260903120692/en/Samsara-Reports-Second-Quarter-Fiscal-Year-2027-Financial-Results",
          "sourceLabel": "Samsara经Business Wire发布的FY2027 Q2财务结果",
          "date": "2026-09-03",
          "eventProperty": "动态类别：财报与AI产品采用",
          "coreFacts": "公司在超过21亿美元ARR规模上保持30%的同比增长，并称部分最新AI功能的客户采用量在最近两个月增长超过4倍。AI采用增速为公司口径，尚未拆分具体功能、客户数、付费转化或单独收入。",
          "strategicSignal": "Samsara的增长显示，海外车队SaaS正在从单一硬件连接转向统一运营数据平台、多产品交叉销售与AI工作流。既有设备和运营入口可能帮助新AI功能进入日常作业，但该结果不能直接外推中国市场的需求和付费水平。",
          "businessConnection": "车队产品对标应增加AI功能采用率、任务闭环率、人工接管率和付费转化等指标，并核对安全、维护、调度和司机工作流是否共用一致的数据主键、权限和审计链。",
          "judgmentSuggestion": "更新Samsara标杆卡，持续跟踪AI采用的具体口径、10万美元及100万美元以上ARR客户和交叉销售情况。\n在一个车队场景中核对AI建议、任务执行、人工接管和结果复核能否形成可审计指标。",
          "rating": 5,
          "summary": "Samsara于9月3日披露截至2026年8月1日的2027财年第二季度业绩：收入5.084亿美元、期末年度经常性收入21.247亿美元，均同比增长30%；公司同时称，部分最新AI功能的客户采用量在最近两个月增长超过4倍。",
          "interpretations": [],
          "downloads": []
        },
        {
          "id": "FXHY-20260904-CB-002",
          "sourceTitle": "嬴彻称搭载其智能驾驶系统车辆的商业运营累计里程突破10亿公里，并扩展车队运营智能",
          "sourceUrl": "https://www.prnasia.com/story/546350-1.shtml",
          "sourceLabel": "嬴彻科技经美通社发布的企业新闻稿",
          "date": "2026-09-03",
          "eventProperty": "动态类别：运营里程碑与能力升级",
          "coreFacts": "公司把真实运营数据用于货运世界模型、场景识别管理和车队级运营智能，尝试从单车辅助驾驶扩展到覆盖干线、支线或城配及末端的运营网络。正式摘要不采用缺少独立口径的市场份额、客户标配比例和场景库规模表述。",
          "strategicSignal": "国内卡车智驾企业正尝试把规模化运行数据转化为模型训练、测试、场景库和车队运营产品，竞争边界可能从驾驶系统供应商延伸至车队安全、能耗、路线和运营决策平台。10亿公里不等于L4无人化，也不自动证明安全优势。",
          "businessConnection": "在智能驾驶和无人货运方向，应明确丰行与车辆智能供应商在调度、风控、客户运营和数据接口上的分工，重点检查车辆风险与能耗数据能否进入可审计的运营闭环。",
          "judgmentSuggestion": "将嬴彻与其他无人货运企业按单车智驾、车队运营、运输网络三个层级建立对标表。\n内部核验丰行在无人货运中的调度、风险管理、客户运营和数据接口角色及可公开边界。",
          "rating": 5,
          "summary": "嬴彻科技9月3日称，搭载其智能驾驶系统车辆的商业运营累计里程突破10亿公里；新闻稿将其当前干线市场业务描述为L2+，并另述多地L4测试和示范。公司同时发布“货运物理AI”能力框架，包含端到端模型、运营场景库和车队“运营大脑”。",
          "interpretations": [],
          "downloads": []
        }
      ]
    },
    {
      "id": "market-opportunity",
      "title": "市场客户趋势与资金项目机会",
      "icon": "Users",
      "description": "客户需求变化、运营痛点以及资金、采购、试点和建设机会",
      "news": [
        {
          "id": "FXHY-20260904-MK-001",
          "sourceTitle": "国货航采购五地六货站车辆安全智能管控平台服务，覆盖336辆OBD与266辆视频监控",
          "sourceUrl": "https://pur.airchina.com.cn/001/001001/20260902/e0e622d8-c3c6-4c06-99d9-83907596db39.html",
          "sourceLabel": "中国航空集团有限公司采购管理平台",
          "date": "2026-09-02",
          "eventProperty": "资金与项目机会\n航空货运与货站运营；中国国际货运航空股份有限公司货站事业部",
          "coreFacts": "采购人以两年期硬件租赁服务模式建设跨区域统一车辆安全管控，覆盖车载终端、属地前置服务器、平台软件、系统集成和持续运维；公告未披露总预算。",
          "strategicSignal": "统一五地六货站的车辆位置、车况、视频、驾驶行为与新能源充电数据；识别违规驾驶和电池安全隐患；实现分级预警、语音提醒、跨系统数据互通、属地化接入和多站点统一监管。",
          "businessConnection": "项目与车队数字化、道路货运安全、车辆运营及新能源车辆管理高度契合。可立即核验供应商准入、五地现场服务、车载视频标准、机场专网和现有系统接口能力；本项目不接受联合体，不能在能力或资质不满足时承诺参与。",
          "judgmentSuggestion": "在9月8日报名截止前，由业务和交付团队核验供应商准入、不可联合体限制、五地现场服务及机场专网适配条件。\n下载附件逐项比对车辆终端、AI视频、OBD或CAN、充电管理、平台接口、告警闭环和运维SLA能力。",
          "rating": 5,
          "summary": "中国国际货运航空股份有限公司货站事业部9月2日启动两年期车辆管理定位系统服务采购，要求为北京、天津、杭州、成都、重庆五地六货站及凤凰天津提供统一的软硬件租赁服务；预计为336辆作业车辆部署OBD采集、为266辆部署视频监控，并建设GIS定位、AI视频、新能源充电管理、驾驶行为闭环告警和多站点数据分析平台。",
          "interpretations": [],
          "downloads": []
        }
      ]
    },
    {
      "id": "tech",
      "title": "技术与能力演进",
      "icon": "Cpu",
      "description": "聚焦技术范式、能力体系与应用路径 的 演进，识别影响行业效率、产品边界与竞争门槛的关键变化。重点判断相关能力从概念走向规模化落地所需达到的成熟度，呈现技术演进对产业能力结构的影响。",
      "news": [
        {
          "id": "FXHY-20260904-TE-001",
          "sourceTitle": "商用车“软件定义”从单车控制走向中央计算、OTA、车挂通信与全资产运营",
          "sourceUrl": "https://press.zf.com/press/en/releases/release_108550.html",
          "sourceLabel": "采埃孚集团（ZF Friedrichshafen AG）官方新闻稿",
          "date": "2026-09-02",
          "eventProperty": "软件定义商用车、中央计算、OTA、车挂一体通信、车辆健康管理和全资产车队运营",
          "coreFacts": "能力边界正由分散控制器、单车定位和孤立车载硬件，向车端中央计算与安全更新、牵引车或挂车通信、云端车队与资产管理、诊断和运营反馈的一体化链条演进；但其中部分功能仍处预览或概念验证阶段。同向官方证据见Webfleet：https://press.bridgestone-emea.com/webfleet-unveils-new-fleet-analytics-and-asset-management-solutions-at-iaa-transportation-2026/ ，Valeo：https://www.valeo.com/en/smarter-safer-more-sustainable-how-valeo-is-engineering-the-future-of-global-trucking-fleets/ 。",
          "strategicSignal": "干线车队、挂车和集装箱管理、园区及场站作业、预测性维护、驾驶安全、车队能耗与利用率分析，以及车辆软硬件全生命周期管理。",
          "businessConnection": "有竞争力的车队平台至少需要统一车辆、挂车和设备身份与状态，支持双向低时延通信、可回滚且可审计的软件升级、诊断闭环、跨车型资产视图及TMS、维修和安全系统接口，并以可用率、能耗和安全结果衡量价值。",
          "judgmentSuggestion": "以采埃孚集团（ZF Friedrichshafen AG）、Webfleet和Valeo的公开能力建立车队平台对标表，核对资产覆盖、OTA或诊断、车挂通信、TMS接口、审计和运营指标。\n内部确认丰行当前可接入的车辆、挂车和设备类型，以及可公开的能力边界。",
          "rating": 4,
          "summary": "采埃孚集团（ZF Friedrichshafen AG）在9月2日发布的软件定义商用车方案中披露安全软件更新、车辆诊断、状态监测、中央车辆智能和卡车—挂车双向实时通信；Webfleet于9月1日发布车队绩效分析并预告统一管理车辆、挂车和设备等资产；Valeo于8月31日披露面向软件定义卡车的集中计算、云端智能和持续功能演进方案。",
          "interpretations": [],
          "downloads": []
        }
      ]
    }
  ],
  "provenance": {
    "type": "validated_intelligence",
    "source_file": "output/weekly/2026-09-04/selected-intelligence.json",
    "source_hash": "2358ad97e8bd32625241e3dff0e6972ac02a72290ddd3fb4069220b877c507b1",
    "content_hash": "9840120c8fb04c90cc17ca0800c0ad8d32569a148824d8399b6ed041403e5070"
  }
}
